{
  "colors": {
    "background": "oklch(1 0 0)",
    "foreground": "oklch(0.145 0 0)",
    "primary": "oklch(0.51 0.23 277)",
    "primary-foreground": "oklch(0.96 0.02 272)",
    "secondary": "oklch(0.967 0.001 286.375)",
    "secondary-foreground": "oklch(0.21 0.006 285.885)",
    "accent": "oklch(0.51 0.23 277)",
    "accent-foreground": "oklch(0.96 0.02 272)",
    "destructive": "oklch(0.58 0.22 27)",
    "muted": "oklch(0.97 0 0)",
    "muted-foreground": "oklch(0.556 0 0)",
    "border": "oklch(0.922 0 0)",
    "input": "oklch(0.922 0 0)",
    "ring": "oklch(0.708 0 0)",
    "card": "oklch(1 0 0)",
    "card-foreground": "oklch(0.145 0 0)",
    "popover": "oklch(1 0 0)",
    "popover-foreground": "oklch(0.145 0 0)",
    "chart1": "oklch(0.79 0.1 275)",
    "chart2": "oklch(0.68 0.16 277)",
    "chart3": "oklch(0.59 0.2 277)",
    "chart4": "oklch(0.51 0.23 277)",
    "chart5": "oklch(0.46 0.21 277)",
    "sidebar": "oklch(0.985 0 0)",
    "sidebarForeground": "oklch(0.145 0 0)",
    "sidebarPrimary": "oklch(0.51 0.23 277)",
    "sidebarPrimaryForeground": "oklch(0.96 0.02 272)",
    "sidebarAccent": "oklch(0.51 0.23 277)",
    "sidebarAccentForeground": "oklch(0.96 0.02 272)",
    "sidebarBorder": "oklch(0.922 0 0)",
    "sidebarRing": "oklch(0.708 0 0)"
  },
  "typography": {
    "text16Medium": {
      "fontSize": "16px",
      "fontWeight": 500,
      "lineHeight": "150%",
      "letterSpacing": "0px"
    }
  },
  "borderRadius": {
    "sm": "calc(0.625rem - 4px)",
    "md": "calc(0.625rem - 2px)",
    "lg": "0.625rem",
    "xl": "calc(0.625rem + 4px)",
    "2xl": "calc(0.625rem + 8px)",
    "3xl": "calc(0.625rem + 12px)",
    "4xl": "calc(0.625rem + 16px)"
  },

  "themes": {
    "dark": {
      "colors": {
        "background": "oklch(0.145 0 0)",
        "foreground": "oklch(0.985 0 0)",
        "primary": "oklch(0.59 0.2 277)",
        "primary-foreground": "oklch(0.96 0.02 272)",
        "secondary": "oklch(0.274 0.006 286.033)",
        "secondary-foreground": "oklch(0.985 0 0)",
        "accent": "oklch(0.59 0.2 277)",
        "accent-foreground": "oklch(0.96 0.02 272)",
        "destructive": "oklch(0.704 0.191 22.216)",
        "muted": "oklch(0.269 0 0)",
        "muted-foreground": "oklch(0.708 0 0)",
        "border": "oklch(1 0 0 / 10%)",
        "input": "oklch(1 0 0 / 15%)",
        "ring": "oklch(0.556 0 0)",
        "card": "oklch(0.205 0 0)",
        "card-foreground": "oklch(0.985 0 0)",
        "popover": "oklch(0.205 0 0)",
        "popover-foreground": "oklch(0.985 0 0)",
        "chart1": "oklch(0.79 0.1 275)",
        "chart2": "oklch(0.68 0.16 277)",
        "chart3": "oklch(0.59 0.2 277)",
        "chart4": "oklch(0.51 0.23 277)",
        "chart5": "oklch(0.46 0.21 277)",
        "sidebar": "oklch(0.205 0 0)",
        "sidebarForeground": "oklch(0.985 0 0)",
        "sidebarPrimary": "oklch(0.68 0.16 277)",
        "sidebarPrimaryForeground": "oklch(0.96 0.02 272)",
        "sidebarAccent": "oklch(0.59 0.2 277)",
        "sidebarAccentForeground": "oklch(0.96 0.02 272)",
        "sidebarBorder": "oklch(1 0 0 / 10%)",
        "sidebarRing": "oklch(0.556 0 0)"
      }
    }
  }
}
